TITLE,AUTHOR,NO OF REVIEWS,RATING,Kindle Edition,Hardcover,Paperbac,Language:,ISBN-10:,ISBN-13:,ASIN:
The Jungle Book (First Stories), ,68 customer reviews,4.4 out of 5 stars,,,,['English'],['9781509808366'],['978-1509808366'],['1509808361']
"Zero to One: Note on Start Ups, or How to Build the Future",Peter Thiel,"1,024 customer reviews",4.3 out of 5 stars,   99.00 ,"   1,250.00 ",,['English'],['9780753555194'],['978-0753555194'],['0753555190']
Amazon Brand - Solimo Board Books for Kids (Set of 10), ,101 customer reviews,4.5 out of 5 stars,,,,['English'],,,['B07BF3T95C']
Refreshing Mandala - Colouring Book for Adults Book 1, ,280 customer reviews,4.6 out of 5 stars,,,,['English'],['9350897601'],['978-9350897607'],
"Nature, Garden and Forest: Colouring Books for Adults with Tear Out Sheets (Adult Colouring Book)", ,26 customer reviews,4.8 out of 5 stars,,,,['English'],['938653858X'],['978-9386538581'],
The Perfect Us,Durjoy Datta,413 customer reviews,4.7 out of 5 stars,   95.72 ,,,['English'],['9780143426592'],['978-0143426592'],['0143426591']
Shapes Colouring Book: Creative Crayons Series - Crayon Copy Colour Books, ,11 customer reviews,4.5 out of 5 stars,,,,['English'],['9387779750'],['978-9387779754'],
 RRB (Railway Recruitment Board) 2019 - Junior Engineer CBT -I & II - Mechanical & Allied Engineering,GKP,10 customer reviews,3.3 out of 5 stars,,,,['English'],['9388426797'],['978-9388426794'],
"Don't Lose Your Mind, Lose Your Weight",Rujuta Diwekar,998 customer reviews,4.5 out of 5 stars,   74.00 ,,,['English'],['9788184001051'],['978-8184001051'],['8184001053']
"Writing Practice A Set Of 4 Books (Writing Fun Pack): Write And Practice Capital Letters, Small Letters and Numbers 1 to 20", ,21 customer reviews,3.8 out of 5 stars,,,,['English'],['9387779777'],['978-9387779778'],
Mandala: Colouring Books for Adults with Tear Out Sheets (Adult Colouring Book), ,38 customer reviews,4.4 out of 5 stars,,,,['English'],['9789386538611'],['978-9386538611'],['938653861X']
RRB (Railway Recruitment Board) 2019 - Junior Engineer CBT -I & II - Electrical Engineering,GKP,9 customer reviews,3.7 out of 5 stars,,,,['English'],['938842686X'],['978-9388426862'],
High School English Grammar and Composition Book (Regular Edition),N.D.V. Prasada Rao,879 customer reviews,4.3 out of 5 stars,   235.60 ,,,['English'],['9352530144'],['978-9352530144'],
"Here, There and Everywhere: Best-Loved Stories of Sudha Murty", ,47 customer reviews,4.6 out of 5 stars,   135.09 ,,,['English'],['9780143444343'],['978-0143444343'],['0143444344']
MPSC CSAT Vishleshan, ,2 customer reviews,4.5 out of 5 stars,,,,['Marathi'],,,['B07L41H6QK']
RRB (Railway Recruitment Board) 2019 - Junior Engineer CBT -I & II - Electronics Engineering,GKP,9 customer reviews,4.0 out of 5 stars,,,,['English'],['9388426584'],['978-9388426589'],
Competitive Handbook of Nursing-VOL 2 (Competitive handbook of nursing), ,25 customer reviews,4.3 out of 5 stars,,,,['English'],,,['B06XHY5B2P']
ESIC Nursing Staff Exam Books Study Materials, , , ,,,,,['9387612937'],['978-9387612938'],
Life is What You Make It,Preeti Shenoy,"2,850 customer reviews",4.0 out of 5 stars,   76.00 ,,,['English'],['9789380349305'],['978-9380349305'],['9380349300']
World Inbox Talati Cum Mantri & Junior Clerk Exam Gujarati Book, ,2 customer reviews,5.0 out of 5 stars,,,,['Gujarati'],['8192603695'],['978-8192603698'],
A Century is not Enough: My Roller-coaster Ride to Success, ,318 customer reviews,4.6 out of 5 stars,,,,['English'],['9789386228567'],['978-9386228567'],['9386228564']
A Competitive Book of Agriculture,Nem Raj Sunda,43 customer reviews,4.1 out of 5 stars,,,,['English'],,,['B0762JWHQV']
The PCOD - Thyroid Book - Compiled From Women and the Weight Loss Tamasha,Rujuta Diwekar,298 customer reviews,4.0 out of 5 stars,   49.00 ,,,['English'],['9789385724411'],['978-9385724411'],['938572441X']
"My First 1000 Words: Early Learning Picture Book to learn Alphabet, Numbers, Shapes and Colours, Transport, Birds and Animals, Professions, Opposite ... Parts of the body and Objects Around Us.", ,6 customer reviews,4.5 out of 5 stars,,,,['English'],['9388144112'],['978-9388144117'],
Panchatantra story Books Set of 5 in Hindi from Inikao, ,27 customer reviews,4.4 out of 5 stars,,,,['Hindi'],,,['B073ZKV16L']
"I Too Had a Love Story, Book 1",Ravinder Singh,"1,913 customer reviews",4.5 out of 5 stars,   69.00 ,   197.00 ,,['English'],['9780143418764'],['978-0143418764'],['0143418769']
"OLD NCERT BOOKS - 1) Ancient India- R.S. SHARMA (CLASS-11), 2) Medieval India - SATISH CHANDRA (CLASS-11), 3) MODERN INDIA - BIPIN CHANDRA (CLASS-12), 4) WORLD HISTORY - ARJUN DEV (CLASS-12)", ,6 customer reviews,4.4 out of 5 stars,,,,,,,['B07FLP3MRQ']
The Book Thief (Definitions Young Adult),Markus Zusak,87 customer reviews,4.5 out of 5 stars,   162.72 ,,,['English'],['9781909531611'],['978-1909531611'],['1909531618']
Colouring Books Collections by InIkao (12 Books), ,191 customer reviews,4.6 out of 5 stars,,,,['English'],['8193628411'],['978-8193628416'],['8193628403']
My Baby Record Book, ,116 customer reviews,4.4 out of 5 stars,,,,['English'],['9350896540'],['978-9350896549'],
RRB (Railway Recruitment Board) 2019 - Junior Engineer CBT -I & II - Civil Engineering,GKP,7 customer reviews,4.1 out of 5 stars,,,,['English'],['9388426843'],['978-9388426848'],
"The Shooting Star: A Girl, Her Backpack and the World",Shivya Nath,137 customer reviews,4.7 out of 5 stars,   153.90 ,,,['English'],['0143443194'],['978-0143443193'],
Civil Engineering: Conventional and Objective Type (2018-19 Session),R.S Khurmi,398 customer reviews,4.1 out of 5 stars,,,,['English'],['812192605X'],['978-8121926058'],
5 Lb. Book of GRE Practice Problems (Manhattan Prep 5 lb Series),Manhattan Prep,150 customer reviews,4.6 out of 5 stars,,,,['English'],['9781941234518'],['978-1941234518'],['1941234518']
Little Kids First Big Book of Animals (First Big Book) (National Geographic Little Kids First Big Books),Catherine D. Hughes,92 customer reviews,4.6 out of 5 stars,   234.65 ,   247.00 ,,['English'],['9781426307041'],['978-1426307041'],['1426307047']
Colouring Books Super Pack: Creative Crayons Series - A Pack Of 6 Crayon Copy Colour Books, ,12 customer reviews,4.4 out of 5 stars,,,,['English'],['9789387779815'],['978-9387779815'],['9387779815']
A Century is not Enough: My Roller-coaster Ride to Success, ,318 customer reviews,4.6 out of 5 stars,,,,['English'],['9789386228567'],['978-9386228567'],['9386228564']
Capital Letters ABC: Write and practice Capital Letters A to Z book for kids (Writing Fun), ,34 customer reviews,4.2 out of 5 stars,,,,['English'],['9386538628'],['978-9386538628'],
"Colouring Book of Transport (Cars, Trains, Airplane and more): Creative Crayons Series - Crayon Copy Colour Books", ,7 customer reviews,4.1 out of 5 stars,,,,['English'],['9387779769'],['978-9387779761'],
Harry Potter and the Philosopher's Stone,J.K. Rowling,"1,080 customer reviews",4.7 out of 5 stars,   284.05 ,,,['English'],['9781408855652'],['978-1408855652'],['1408855658']
A Handbook on Mechanical Engineering - Contains well Illustrated Formulae and Key Theory Concepts, ,592 customer reviews,4.3 out of 5 stars,,,,['English'],['935147125X'],['978-9351471257'],
NCERT History Books Set of Class - 6 TO 12 (ENGLISH MEDIUM) for UPSC Prelims / Main / IAS / Civil Services / IFS / IES / ISS / CISF / CDS / SCRA / IFS / NDA and more, ,19 customer reviews,3.8 out of 5 stars,,,,,,,['B078V1J6HP']
Word Power Made Easy,Norman Lewis,"5,619 customer reviews",4.4 out of 5 stars,   81.00 ,,,['English'],['8183071007'],['978-8183071000'],
The Communication Book,Mikael Krogerus,13 customer reviews,3.8 out of 5 stars,   148.36 ,,,['English'],['0241982286'],['978-0241982280'],
Baniye Network Marketing Millionaire, ,68 customer reviews,4.8 out of 5 stars,   140.00 ,,,['Hindi'],['9387328813'],['978-9387328815'],
Rich Dad Poor Dad (Marathi),Robert T. Kiyosaki,"3,535 customer reviews",4.5 out of 5 stars,   147.25 ,,,['Marathi'],['9788183220378'],['978-8183220378'],['8183220371']
Abhinav Year Book 2019, , , ,,,,['Marathi'],,,['B07MBSWNV8']
How to Prepare for Verbal Ability and Reading Comprehension for the CAT,Arun Sharma,151 customer reviews,4.6 out of 5 stars,,,,['English'],['9789353160197'],['978-9353160197'],['9353160197']
How to Prepare for Verbal Ability and Reading Comprehension for the CAT,Arun Sharma,151 customer reviews,4.6 out of 5 stars,,,,['English'],['9789353160197'],['978-9353160197'],['9353160197']
Happiness Express,Khurshed Batliwala,25 customer reviews,4.9 out of 5 stars,   221.35 ,,,['English'],['9387894193'],['978-9387894198'],
Sita: Warrior of Mithila (Ram Chandra),Amish Tripathi,"1,808 customer reviews",4.3 out of 5 stars,   180.50 ,,,['English'],['9386224585'],['978-9386224583'],
Gikso Activity Book – 1 for Kids Age 3-5 Years Old,GIKSO,5 customer reviews,4.8 out of 5 stars,,,,['English'],['8193317386'],['978-8193317389'],
Kiran’s Railway Assistant Loco Pilot (ALP) & Technician Stage 2 (Part A) Exam Practice Work Book - 2386,Kiran Prakashan,8 customer reviews,3.3 out of 5 stars,   110.20 ,,,['English'],,,['B07KM16SD8']
"Brain Boosting Activity Book - Age 4+: Match the Pair, Find the Difference, Maze, Crossword, Dot-to-Dot  (4+ Yrs)", ,103 customer reviews,4.1 out of 5 stars,,,,['English'],['9350895641'],['978-9350895641'],
Cursive Writing Book (Set of 7 Books), ,101 customer reviews,4.3 out of 5 stars,,,,['English'],['8184518218'],['978-8184518214'],
Civil Engineering: Through Objective Type Questions, ,301 customer reviews,4.2 out of 5 stars,   265.60 ,,,['English'],['8123907974'],['978-8123907970'],
Certificate Physical and Human Geography, ,1 customer review,5.0 out of 5 stars,,,,['English'],,,['B073QVD572']
Cambridge IELTS 12 Academic Student's Book with Answers: Authentic Examination Papers (IELTS Practice Tests), ,3 customer reviews,4.0 out of 5 stars,,,,['English'],['1316637824'],['978-1316637821'],
Indian Navy Secondary SSR Guide 2018, ,20 customer reviews,4.1 out of 5 stars,,,,['English'],['9312148885'],['978-9312148884'],
Lift the Flap Busy Zoo (Lift the Flap Book), ,89 customer reviews,4.5 out of 5 stars,,,,['English'],['9781409308553'],['978-1409308553'],['1409308553']
Little Kids First Big Book of Why (First Big Book) (National Geographic Little Kids First Big Books),Amy Shields,103 customer reviews,4.4 out of 5 stars,   308.75 ,   325.00 ,,['English'],['1426307934'],['978-1426307935'],
Chemistry Textbook Part - 1 for Class - 12  - 12085, ,94 customer reviews,3.7 out of 5 stars,,,,['English'],['8174506489'],['978-8174506481'],
"Brain Boosting Activity Book: Match the Pair, Find the Difference, Maze, Crossword, Dot-to-Dot  (3+ Yrs)", ,53 customer reviews,4.1 out of 5 stars,,,,['English'],['9350895633'],['978-9350895634'],
International Mathematics Olympiad Work Book (IMO) - Class 3 for 2018-19,Mahabir Singh,106 customer reviews,4.3 out of 5 stars,   56.00 ,,,['English'],['9387351718'],['978-9387351714'],
International Mathematics Olympiad Work Book (IMO) - Class 3 for 2018-19,Mahabir Singh,106 customer reviews,4.3 out of 5 stars,   56.00 ,,,['English'],['9387351718'],['978-9387351714'],
Peppa Pig: Little Library, ,675 customer reviews,4.0 out of 5 stars,,,,['English'],['9781409303183'],['978-1409303183'],['1409303187']
1001 Activities Book, ,169 customer reviews,4.5 out of 5 stars,,,,['English'],['9350897245'],['978-9350897249'],
Combined CDS (OTA) Book, ,64 customer reviews,4.5 out of 5 stars,,,,['English'],['819382590X'],['978-8193825907'],['B07BQ1KTDC']
Physics Text Book Part 1 for Class 12  - 12089, ,67 customer reviews,3.7 out of 5 stars,,,,['English'],['8174506314'],['978-8174506313'],
Pathfinder for NDA & NA National Defence Academy Naval Academy Entrance Examination, ,169 customer reviews,4.3 out of 5 stars,,,,['English'],['9312146734'],['978-9312146736'],
NCERT Biology Textbook For Class - 11 And Class - 12 ( Set Of 2 Books Combo ), ,21 customer reviews,3.6 out of 5 stars,,,,['English'],,,['B079BJDSC9']
Target High - 4th Edition, ,24 customer reviews,4.6 out of 5 stars,,,,['English'],['9387964787'],['978-9387964785'],['B07J9HY648']
Baby Record Book for Girls, ,336 customer reviews,4.4 out of 5 stars,,   280.00 ,,['English'],['9789381607602'],['978-9381607602'],['9381607605']
Animal Farm,George Orwell,137 customer reviews,4.5 out of 5 stars,,,,['English'],['8193387643'],['978-8193387641'],
RRB Junior Engineer 2018-19 : Chapter-wise & Year-wise Solved Papers 2014 & 15 (17 Sets),GKP,17 customer reviews,4.4 out of 5 stars,,,,['English'],['9388182561'],['978-9388182560'],
IB Intelligence Bureau Security Assistant and Executive (Group C) Exam Books, ,2 customer reviews,5.0 out of 5 stars,,,,,['9387612791'],['978-9387612792'],
How to Prepare for Logical Reasoning for CAT,Arun Sharma,115 customer reviews,4.0 out of 5 stars,   343.90 ,,,['English'],['9789352606948'],['978-9352606948'],['9352606949']
Mandala Art: Colouring Books for Adults with Tear Out Sheets (Adult Colouring Book), ,13 customer reviews,4.6 out of 5 stars,,,,['English'],['9386538601'],['978-9386538604'],
Heat And Mass Transfer Data Book (Multi Colour Edition),C.P. Kothandaraman,52 customer reviews,4.3 out of 5 stars,,,,['English'],['9789386649300'],['978-9386649300'],['9386649306']
The Prophet,Kahlil Gibran,237 customer reviews,4.5 out of 5 stars,   25.00 ,   741.00 ,,['English'],['817234354X'],['978-8172343545'],
Story Books set of 10 in English with 101 Moral Stories from Inikao, ,97 customer reviews,4.1 out of 5 stars,,,,['English'],,,['B073PG7S69']
SSC Constable Exam Guide 2018, ,14 customer reviews,3.8 out of 5 stars,,,,['Hindi'],['9313163381'],['978-9313163381'],
Audit of a CA, ,84 customer reviews,4.8 out of 5 stars,,,,,,,['B07K7MVW7K']
A Modern Approach to Verbal & Non-Verbal Reasoning,R.S. Aggarwal,351 customer reviews,4.4 out of 5 stars,,,,['English'],['9789352832163'],['978-9352832163'],['9352832167']
Geronimo Stilton and the Kingdom of Fantasy #11: The Guardian of the Realm,Geronimo Stilton,49 customer reviews,4.8 out of 5 stars,,   390.00 ,,['English'],['9789352755165'],['978-9352755165'],['9352755162']
Cambridge IELTS 12 General Training Student's Book with Answers: Authentic Examination Papers (IELTS Practice Tests), ,8 customer reviews,2.6 out of 5 stars,,,,['English'],['1316637832'],['978-1316637838'],
International Mathematics Olympiad Work Book (IMO) - Class 4 for 2018-19,Mahabir Singh,56 customer reviews,4.4 out of 5 stars,   49.60 ,,,['English'],['9387351726'],['978-9387351721'],
"Cengage Maths Set Of 5 Books 2019  (Paperback, G TIWANI)", ,30 customer reviews,4.8 out of 5 stars,,,,,,,['B07D38DFC7']
Ayurvediya Garbh Sanskar (Marathi),Shree Balaji Tambe,406 customer reviews,4.5 out of 5 stars,,   597.00 ,,['Marathi'],['9789380571089'],['978-9380571089'],['9380571089']
"Master Reasoning Book Verbal, Non-Verbal & Analytical", ,88 customer reviews,4.5 out of 5 stars,,,,['Hindi'],['935251307X'],['978-9352513079'],
Satyayoddha Kalki: Eye of Brahma (Book 2),Kevin Missal,32 customer reviews,4.2 out of 5 stars,,,,['English'],['9388369157'],['978-9388369152'],
The Richest Man in Babylon,George S. Clason,52 customer reviews,4.7 out of 5 stars,   94.05 ,,,['English'],['9789388144315'],['978-9388144315'],['9388144317']
Design Data: Data Book Of Engineers By PSG College-Kalaikathir Achchagam - Coimbatore, ,34 customer reviews,4.0 out of 5 stars,,,,['English'],['8192735508'],['978-8192735504'],
All In One Board Books (All in one Board books Reading), ,187 customer reviews,4.7 out of 5 stars,,,,['English'],,,['B0194VTSOY']
How to Prepare for Data Interpretation for CAT,Arun Sharma,93 customer reviews,4.2 out of 5 stars,   421.80 ,,,['English'],['9352606930'],['978-9352606931'],
2019 CFA Level 1 study package (Entire set), ,3 customer reviews,5.0 out of 5 stars,,,,,,,['B07MLDHZ6W']
The Wimpy Kid: Do-it-Yourself Book (Diary of a Wimpy Kid),Jeff Kinney,332 customer reviews,4.6 out of 5 stars,,,,['English'],['0141339667'],['978-0141339665'],
Animal ABC: Playful animals teach A to Z (Padded Board Book), ,11 customer reviews,4.5 out of 5 stars,,,,['English'],['9789387779013'],['978-9387779013'],['9387779017']
Tom Gates Book #3: Everythings Amazing, ,56 customer reviews,4.8 out of 5 stars,   158.65 ,,,['English'],['9789351033011'],['978-9351033011'],['9351033015']
Handbook of Mathematics, ,355 customer reviews,4.4 out of 5 stars,,,,['English'],['935203659X'],['978-9352036592'],
International Mathematics Olympiad Work Book (IMO) - Class 2 for 2018-19,Mahabir Singh,61 customer reviews,4.2 out of 5 stars,   60.80 ,,,['English'],['938735170X'],['978-9387351707'],
Double Down (Diary of a Wimpy Kid Book 11),Jeff Kinney,630 customer reviews,4.6 out of 5 stars,   153.90 ,,,['English'],['0141379022'],['978-0141379029'],
Ikigai,Héctor García,34 customer reviews,4.0 out of 5 stars,   269.00 ,   364.00 ,,['English'],['178633089X'],['978-1786330895'],
 , , , ,,,,,,,
 , , , ,,,,,,,
Turning Points : A Journey Through Challanges: A Journey Through Challenges,A.P.J. Abdul Kalam,408 customer reviews,4.7 out of 5 stars,   120.65 ,,,['English'],['9350293471'],['978-9350293478'],
 , , , ,,,,,,,
Nata Exam Full Package, ,73 customer reviews,4.4 out of 5 stars,,,,,,,['B07913RHJ3']
"NCC: Handbook of NCC Cadets for 'A', 'B' and 'C' Certificate Examinations",R.K. Gupta,4 customer reviews,4.7 out of 5 stars,   157.50 ,,,['English'],['9387918572'],['978-9387918573'],
Chalu Ghadamodi Antim Satya Year Book 2019, ,8 customer reviews,3.4 out of 5 stars,,,,,['8193852680'],['978-8193852682'],
 , , , ,,,,,,,
Olympiad Books Practice Sets -  Mathematics Class 4 for 2018 - 19, ,25 customer reviews,4.4 out of 5 stars,,,,['English'],['9352512073'],['978-9352512072'],
Chalu Ghadamodi Antim Satya Year Book 2019, ,8 customer reviews,3.4 out of 5 stars,,,,,['8193852680'],['978-8193852682'],
 , , , ,,,,,,,
 , , , ,,,,,,,
Numbers 1 - 10: Write and Practice Numbers 1 to 10 (Writing Fun), ,33 customer reviews,4.2 out of 5 stars,,,,['English'],['9386538644'],['978-9386538642'],
 , , , ,,,,,,,
Geronimo Stilton - The Hunt for the Golden Book,Geronimo Stilton,179 customer reviews,4.4 out of 5 stars,   299.25 ,,,['English'],['9351032167'],['978-9351032168'],
Bank Financial Management, ,75 customer reviews,4.3 out of 5 stars,,,,['English'],['9789387000650'],['978-9387000650'],['9387000656']
 , , , ,,,,,,,
Catalyst,Chandramouli Venkatesan,244 customer reviews,4.6 out of 5 stars,   161.85 ,,,['English'],['9780143442479'],['978-0143442479'],['0143442473']
The Secret Seven: Is Exciting Adventures (Set of 15 Books), ,130 customer reviews,4.7 out of 5 stars,,,,['English'],['1444916424'],['978-1444916423'],
 , , , ,,,,,,,
The Book of Indian Birds, ,145 customer reviews,4.5 out of 5 stars,,   520.00 ,,['English'],['9780195665239'],['978-0195665239'],['0195665236']
 , , , ,,,,,,,
 , , , ,,,,,,,
 , , , ,,,,,,,
 , , , ,,,,,,,
Prep Guide To BITSAT 2019, ,19 customer reviews,4.1 out of 5 stars,,,,['English'],['9313163802'],['978-9313163800'],
sugam marathi vyakaran with shabdratn and sarav prashnsanch set of 3 books, ,21 customer reviews,4.4 out of 5 stars,,,,,,,['B077RF1QVZ']
How to Crack Test Of Reasoning,Jaikishan,2 customer reviews,5.0 out of 5 stars,,,,['English'],['9313166755'],['978-9313166757'],
 , , , ,,,,,,,
The Power of Positive Thinking,Norman Vincent Peale,779 customer reviews,3.9 out of 5 stars,   72.49 ,   110.00 ,,['English'],['9780091906382'],['978-0091906382'],['0091906385']
 , , , ,,,,,,,
 , , , ,,,,,,,
P. J. MEHTA'S Practical Medicine 21st ed 2018, ,6 customer reviews,4.8 out of 5 stars,,,,,['9788190704625'],['978-8190704625'],['8190704621']
Environment By Shankar IAS Academy (6th Edition) 2018-2019, ,4 customer reviews,3.1 out of 5 stars,,,,,,,['B07KZQWPPS']
 , , , ,,,,,,,
 , , , ,,,,,,,
 , , , ,,,,,,,
IMU-CET Exam Full Package, ,225 customer reviews,4.7 out of 5 stars,,,,,,,['B078VDMNXW']
 , , , ,,,,,,,
 , , , ,,,,,,,
Nursery Rhymes (My Jumbo Books), ,84 customer reviews,4.5 out of 5 stars,   113.40 ,,,['English'],['8184516207'],['978-8184516203'],
 , , , ,,,,,,,
Milk and Honey,Rupi Kaur,312 customer reviews,4.3 out of 5 stars,   190.00 ,   599.00 ,,['English'],['9781449474256'],['978-1449474256'],['144947425X']
Nursery Rhymes (First Padded Board Books), ,143 customer reviews,3.7 out of 5 stars,   40.95 ,,,['English'],['8184514492'],['978-8184514490'],
NTA UGC NET/SET/JRF - Paper 1: Teaching and Research Aptitude by Pearson,KVS Madaan,495 customer reviews,4.4 out of 5 stars,   172.00 ,,,['English'],['9332551731'],['978-9332551732'],
 , , , ,,,,,,,
 , , , ,,,,,,,
"Pregnancy Notes: Before, During & After",Rujuta Diwekar,234 customer reviews,3.9 out of 5 stars,   49.00 ,,,['English'],['9386224895'],['978-9386224897'],
Nata Exam Full Package, ,73 customer reviews,4.4 out of 5 stars,,,,,,,['B07913RHJ3']
 , , , ,,,,,,,
Great Stories for Children,Ruskin Bond,216 customer reviews,4.3 out of 5 stars,   147.00 ,,,['English'],['8129118920'],['978-8129118929'],
 , , , ,,,,,,,
Samanya Gyan 2019,Manohar Pandey,61 customer reviews,4.2 out of 5 stars,,,,['Hindi'],['9312147293'],['978-9312147290'],
Grandma's Bag of Stories, ,546 customer reviews,4.5 out of 5 stars,   135.09 ,,,['English'],['9780143333623'],['978-0143333623'],['0143333623']
Handbook of Chemistry, ,364 customer reviews,4.3 out of 5 stars,,,,['English'],['9789352036042'],['978-9352036042'],['9352036042']
Panorama Year Book 2019, ,2 customer reviews,4.5 out of 5 stars,,,,['English'],,,['B07KLPTWHJ']
 , , , ,,,,,,,
 , , , ,,,,,,,
 , , , ,,,,,,,
 , , , ,,,,,,,
Little Kids First Big Book of Space (First Big Book) (National Geographic Little Kids First Big Books),Catherine D. Hughes,132 customer reviews,4.7 out of 5 stars,   221.35 ,   233.00 ,,['English'],['1426310145'],['978-1426310140'],
 , , , ,,,,,,,
Colouring Book of Fruits: Creative Crayons Series - Crayon Copy Colour Books, ,6 customer reviews,4.1 out of 5 stars,,,,['English'],['9387779734'],['978-9387779730'],
KIRAN’S RAILWAY ALP & TECHNICIAN STAGE - 2 BASIC SCIENCE & ENGINEERING DRAWING GENERAL SCIENCE & ENGINEERING DRAWING - ENGLISH, ,12 customer reviews,2.6 out of 5 stars,   184.30 ,,,,,,['B07LBVP15T']
Railway Junior Engineering Guide (Stage 1) 2019, , , ,,,,['English'],['9313169797'],['978-9313169796'],
Her Last Wish,Ajay K. Pandey,996 customer reviews,4.7 out of 5 stars,   49.00 ,,,['English'],['9382665870'],['978-9382665878'],
 , , , ,,,,,,,
 , , , ,,,,,,,
 , , , ,,,,,,,
The Paradoxical Prime Minister,Shashi Tharoor,179 customer reviews,2.9 out of 5 stars,   230.00 ,   495.00 ,,['English'],['9388292170'],['978-9388292177'],
Guide To JAIIB Legal Aspects Principles Of Banking & Accounting: Set Of 3 Books Paperback (English) 2017 EDITION, ,52 customer reviews,4.2 out of 5 stars,,,,,,,['B0722FQTBZ']
 , , , ,,,,,,,
High School English Grammar and Composition Book (Multicolour Edition),N.D.V. Prasada Rao,123 customer reviews,4.4 out of 5 stars,   265.05 ,,,['English'],['935253008X'],['978-9352530083'],
 , , , ,,,,,,,
 , , , ,,,,,,,
 , , , ,,,,,,,
 , , , ,,,,,,,
 , , , ,,,,,,,
 , , , ,,,,,,,
Rogi Swayam Chikitsak;Part 1, ,109 customer reviews,4.6 out of 5 stars,   205.00 ,,,['Hindi'],,,['B073BM727J']
 , , , ,,,,,,,
 , , , ,,,,,,,
Latitudes of Longing, ,18 customer reviews,4.4 out of 5 stars,   313.19 ,   450.00 ,,['English'],['9789353020262'],['978-9353020262'],['9353020263']
 , , , ,,,,,,,
Origin (Robert Langdon),Dan Brown,"1,178 customer reviews",4.0 out of 5 stars,   177.60 ,   485.00 ,,['English'],['0552174165'],['978-0552174169'],
Think & Grow Rich (Hindi),Napoleon Hill,327 customer reviews,4.3 out of 5 stars,   94.05 ,,,['Hindi'],['8175993561'],['978-8175993563'],
 , , , ,,,,,,,
 , , , ,,,,,,,
International Mathematics Olympiad Work Book (IMO) - Class 5 for 2018-19,Mahabir Singh,47 customer reviews,4.4 out of 5 stars,   60.80 ,,,['English'],['9387351734'],['978-9387351738'],
 , , , ,,,,,,,
Dnyandeep MPSC Rajyaseva Purva Samanya Adhyayan - II Prashnapatrika Vishleshan CSAT: 2016 - 2018, ,1 customer review,5.0 out of 5 stars,,,,['Marathi'],,,['B07L7B1WSG']
Effortless Weight Loss - English, ,17 customer reviews,4.5 out of 5 stars,,,,['English'],['9385266942'],['978-9385266942'],
The Book of Faith,Navjot Gautam,22 customer reviews,5.0 out of 5 stars,   359.10 ,,,['English'],['9387944956'],['978-9387944954'],
Magical Books On Quicker Maths (2018-2019) Session by M. Tyra, ,"1,030 customer reviews",4.1 out of 5 stars,   236.55 ,,,['English'],['8190458922'],['978-8190458924'],
Don't Tell The Governor,Ravi Subramanian,98 customer reviews,3.9 out of 5 stars,   140.92 ,,,['English'],['9353024625'],['978-9353024628'],
 , , , ,,,,,,,
 , , , ,,,,,,,
"National Geographic Kids Why?: Over 1,111 Answers to Everything",Crispin Boyer,39 customer reviews,4.7 out of 5 stars,,,,['English'],['1426320973'],['978-1426320972'],
 , , , ,,,,,,,
You Are Born to Blossom,A.P.J Abdul Kalam,209 customer reviews,4.6 out of 5 stars,   51.45 ,   225.00 ,,['English'],['818430336X'],['978-8184303360'],
Chemistry Textbook Part - 1 for Class - 11  - 11082, ,114 customer reviews,3.7 out of 5 stars,,,,['English'],['817450494X'],['978-8174504944'],
KIRAN’S RAILWAY ALP & TECHNICIAN STAGE - 2 BASIC SCIENCE & ENGINEERING DRAWING GENERAL SCIENCE & ENGINEERING DRAWING - ENGLISH, ,12 customer reviews,2.6 out of 5 stars,   184.30 ,,,,,,['B07LBVP15T']
 , , , ,,,,,,,
Englishwale.com English Speaking Course Book, ,29 customer reviews,4.5 out of 5 stars,,,,['English'],['8193074300'],['978-8193074305'],
 , , , ,,,,,,,
 , , , ,,,,,,,
 , , , ,,,,,,,
"Develop Self-Confidence, Improve Public Speaking",Dale Carnegie,40 customer reviews,4.1 out of 5 stars,   58.90 ,,,['English'],['8129140160'],['978-8129140166'],
